{
  "schema": "1.0",
  "notes": "Fictional demo providers only (labelled DEMO). Posts go straight into the RideWatch pipeline from DemoSource and never mix with live legs. Wordings match the demo.* notification_templates. trip_km is the straight-line (haversine) distance; the gate applies road_factor itself.",
  "trip": {
    "pickup": {
      "label": "Riverside Gate",
      "lat": 26.1445,
      "lng": 91.7362
    },
    "drop": {
      "label": "Airport Terminal",
      "lat": 26.1112,
      "lng": 91.63442
    },
    "trip_km": 10.81
  },
  "providers": {
    "demo.kestrel": {
      "name": "Kestrel Go",
      "wire_id": "demo_kestrel",
      "version_code": 1,
      "screens": {
        "fare_options": "demo/kestrel/fare_options.png",
        "searching": "demo/kestrel/searching.png",
        "driver_assigned": "demo/kestrel/driver_assigned.png",
        "cancel_flow": "demo/kestrel/cancel_flow.png",
        "cancelled": "demo/kestrel/cancelled.png"
      },
      "cancel_flow_from": "searching",
      "booked": {
        "vehicle_class": "auto",
        "label": "Auto",
        "price_min": 180,
        "price_max": 210
      }
    },
    "demo.pepper": {
      "name": "Pepper Rides",
      "wire_id": "demo_pepper",
      "version_code": 1,
      "screens": {
        "fare_options": "demo/pepper/fare_options.png",
        "searching": "demo/pepper/searching.png",
        "driver_assigned": "demo/pepper/driver_assigned.png",
        "cancel_flow": "demo/pepper/cancel_flow.png",
        "cancelled": "demo/pepper/cancelled.png",
        "driver_assigned_better": "demo/pepper/driver_assigned_better.png"
      },
      "cancel_flow_from": "driver_assigned",
      "booked": {
        "vehicle_class": "auto",
        "label": "ऑटो",
        "price_min": 172,
        "price_max": 172
      }
    },
    "demo.tamarind": {
      "name": "Tamarind Cabs",
      "wire_id": "demo_tamarind",
      "version_code": 1,
      "screens": {
        "fare_options": "demo/tamarind/fare_options.png",
        "searching": "demo/tamarind/searching.png",
        "driver_assigned": "demo/tamarind/driver_assigned.png",
        "cancel_flow": "demo/tamarind/cancel_flow.png",
        "cancelled": "demo/tamarind/cancelled.png"
      },
      "cancel_flow_from": "searching",
      "booked": {
        "vehicle_class": "auto",
        "label": "Auto",
        "price_min": 176,
        "price_max": 176
      }
    }
  },
  "user_steps": {
    "book:<package>": "The user taps 'Booked here' after reading that provider's fare screen.",
    "cancel_others:yes": "The user taps 'Yes, cancel the others' on the first-driver sheet.",
    "cancel_others:not_now": "The user keeps searching instead (only offered when keep searching is on).",
    "tapped_cancel:<package>": "On that provider's demo cancel screen the user taps 'Cancel ride'.",
    "better_ride:yes": "The user accepts the better-ride offer."
  },
  "tracks": [
    {
      "id": "main",
      "description": "Book all three; Pepper finds the first driver; 'Cancel the others?' → Yes; Kestrel and Tamarind are cancelled with proof (rung 2); reminders while any is pending; Pepper's ride ends → pay in Pepper Rides.",
      "requires": {
        "keep_searching": false
      },
      "events": [
        {
          "id": "kestrel_searching_1",
          "t_ms": 1200,
          "requires_user_step": "book:demo.kestrel",
          "action": "post",
          "package": "demo.kestrel",
          "sbn_key": "0|demo.kestrel|7001|ride|10501",
          "channel_id": "kestrel_trip",
          "category": "status",
          "ongoing": true,
          "title": "Kestrel Go",
          "text": "Finding a rider for your Auto…",
          "expect_event": "SEARCHING",
          "screen": "searching"
        },
        {
          "id": "pepper_searching_2",
          "t_ms": 1200,
          "requires_user_step": "book:demo.pepper",
          "action": "post",
          "package": "demo.pepper",
          "sbn_key": "0|demo.pepper|7101|ride|10502",
          "channel_id": "pepper_ride_status",
          "category": "status",
          "ongoing": true,
          "title": "Pepper Rides",
          "text": "Searching for nearby drivers…",
          "expect_event": "SEARCHING",
          "screen": "searching"
        },
        {
          "id": "tamarind_searching_3",
          "t_ms": 1200,
          "requires_user_step": "book:demo.tamarind",
          "action": "post",
          "package": "demo.tamarind",
          "sbn_key": "0|demo.tamarind|7201|ride|10503",
          "channel_id": "tamarind_live",
          "category": "status",
          "ongoing": true,
          "title": "Tamarind Cabs",
          "text": "ड्राइवर खोज रहे हैं · Looking for a driver…",
          "expect_event": "SEARCHING",
          "screen": "searching"
        },
        {
          "id": "pepper_assigned_4",
          "t_ms": 9000,
          "requires_user_step": "book:demo.tamarind",
          "action": "post",
          "package": "demo.pepper",
          "sbn_key": "0|demo.pepper|7101|ride|10502",
          "channel_id": "pepper_ride_status",
          "category": "status",
          "ongoing": true,
          "title": "Driver assigned",
          "text": "Ravi · XX 00 DM 4821 · arriving in 9 min · 2.8 km away",
          "expect_event": "ASSIGNED",
          "expect_groups": {
            "plate": "XX 00 DM 4821",
            "eta": "9",
            "dist": "2.8 km"
          },
          "screen": "driver_assigned"
        },
        {
          "id": "kestrel_cancelled_5",
          "t_ms": 1500,
          "requires_user_step": "tapped_cancel:demo.kestrel",
          "action": "post",
          "package": "demo.kestrel",
          "sbn_key": "0|demo.kestrel|7002|alert|10501",
          "channel_id": "kestrel_alerts",
          "category": null,
          "ongoing": false,
          "title": "Trip cancelled",
          "text": "Your Kestrel Go trip was cancelled. No fee charged.",
          "expect_event": "CANCELLED",
          "screen": "cancelled"
        },
        {
          "id": "kestrel_ongoing_removed_6",
          "t_ms": 1600,
          "requires_user_step": "tapped_cancel:demo.kestrel",
          "action": "remove",
          "package": "demo.kestrel",
          "sbn_key": "0|demo.kestrel|7001|ride|10501",
          "channel_id": "kestrel_trip",
          "category": "status",
          "ongoing": true,
          "title": "Kestrel Go",
          "text": "Finding a rider for your Auto…",
          "removal_reason": "REASON_APP_CANCEL"
        },
        {
          "id": "tamarind_cancelled_7",
          "t_ms": 1500,
          "requires_user_step": "tapped_cancel:demo.tamarind",
          "action": "post",
          "package": "demo.tamarind",
          "sbn_key": "0|demo.tamarind|7202|alert|10503",
          "channel_id": "tamarind_info",
          "category": null,
          "ongoing": false,
          "title": "राइड रद्द · Ride cancelled",
          "text": "Your Tamarind Cabs booking was cancelled.",
          "expect_event": "CANCELLED",
          "screen": "cancelled"
        },
        {
          "id": "tamarind_ongoing_removed_8",
          "t_ms": 1600,
          "requires_user_step": "tapped_cancel:demo.tamarind",
          "action": "remove",
          "package": "demo.tamarind",
          "sbn_key": "0|demo.tamarind|7201|ride|10503",
          "channel_id": "tamarind_live",
          "category": "status",
          "ongoing": true,
          "title": "Tamarind Cabs",
          "text": "ड्राइवर खोज रहे हैं · Looking for a driver…",
          "removal_reason": "REASON_APP_CANCEL"
        },
        {
          "id": "pepper_arriving_9",
          "t_ms": 10000,
          "requires_user_step": "tapped_cancel:demo.tamarind",
          "action": "post",
          "package": "demo.pepper",
          "sbn_key": "0|demo.pepper|7101|ride|10502",
          "channel_id": "pepper_ride_status",
          "category": "status",
          "ongoing": true,
          "title": "Driver has arrived",
          "text": "Ravi is at your pickup point. Your PIN is 5302.",
          "expect_event": "ARRIVING"
        },
        {
          "id": "pepper_trip_started_10",
          "t_ms": 25000,
          "requires_user_step": "tapped_cancel:demo.tamarind",
          "action": "post",
          "package": "demo.pepper",
          "sbn_key": "0|demo.pepper|7101|ride|10502",
          "channel_id": "pepper_ride_status",
          "category": "status",
          "ongoing": true,
          "title": "Ride started",
          "text": "Have a safe ride!",
          "expect_event": "TRIP_STARTED"
        },
        {
          "id": "pepper_ended_11",
          "t_ms": 45000,
          "requires_user_step": "tapped_cancel:demo.tamarind",
          "action": "post",
          "package": "demo.pepper",
          "sbn_key": "0|demo.pepper|7102|alert|10502",
          "channel_id": "pepper_updates",
          "category": null,
          "ongoing": false,
          "title": "Ride completed",
          "text": "Please pay ₹172 in Pepper Rides.",
          "expect_event": "ENDED"
        },
        {
          "id": "pepper_ongoing_removed_12",
          "t_ms": 45100,
          "requires_user_step": "tapped_cancel:demo.tamarind",
          "action": "remove",
          "package": "demo.pepper",
          "sbn_key": "0|demo.pepper|7101|ride|10502",
          "channel_id": "pepper_ride_status",
          "category": "status",
          "ongoing": true,
          "title": "Ride started",
          "text": "Have a safe ride!",
          "removal_reason": "REASON_APP_CANCEL"
        }
      ],
      "checkpoints": [
        {
          "after_user_step": "book:demo.tamarind",
          "at_ms": 9000,
          "expect": "first_driver_sheet",
          "package": "demo.pepper",
          "driver_eta_min": 9,
          "driver_distance_text": "2.8 km"
        },
        {
          "after_user_step": "cancel_others:yes",